{
  "$schema": "https://json-schema.org/draft/2020-12/schema",
  "$id": "https://ardur.dev/vibap/spec/mission-governance/v0alpha1/declaration.schema.json",
  "title": "Mission Declaration",
  "description": "A mission declaration captures the complete set of permissions granted to an AI agent for a specific governance session. It enumerates allowed actions, tools, resources, side effects, and delegation constraints. The reconciler compares observed agent behavior against this declaration to produce findings and decisions.",
  "type": "object",
  "additionalProperties": false,
  "required": [
    "id",
    "session_id",
    "allowed_actions",
    "allowed_tools",
    "created_at"
  ],
  "properties": {
    "id": {
      "type": "string",
      "minLength": 1,
      "description": "Unique identifier for this declaration. Must be non-empty. Typically a UUID or structured identifier scoped to the issuing authority."
    },
    "session_id": {
      "type": "string",
      "minLength": 1,
      "description": "Identifier of the governance session this declaration belongs to. Links the declaration to the session lifecycle and all associated events and decisions."
    },
    "allowed_actions": {
      "type": "array",
      "items": {
        "type": "string",
        "minLength": 1
      },
      "minItems": 1,
      "description": "List of action classes the agent is permitted to perform. Values correspond to the action_class enum in observed events: search, read, write, query, delegate, send, summarize, observe."
    },
    "allowed_tools": {
      "type": "array",
      "items": {
        "type": "string",
        "minLength": 1
      },
      "minItems": 1,
      "description": "List of tool names the agent is permitted to invoke. Any tool invocation not in this list constitutes a violation."
    },
    "allowed_resources": {
      "type": "array",
      "items": {
        "type": "string",
        "minLength": 1
      },
      "description": "Explicit list of resource identifiers the agent may access. When omitted, resource-level checking is not enforced and only resource family constraints apply."
    },
    "allowed_resource_families": {
      "type": "array",
      "items": {
        "type": "string",
        "minLength": 1
      },
      "description": "Coarse-grained resource families the agent may access, such as 'code', 'documentation', 'database', 'email'. Provides category-level access control when enumerating every individual resource is impractical."
    },
    "allowed_side_effects": {
      "type": "array",
      "items": {
        "type": "string",
        "enum": [
          "none",
          "internal_write",
          "external_send",
          "state_change"
        ]
      },
      "description": "Side effect classes the agent is permitted to produce. Maps to the side_effect_class enum on observed events. When omitted, only 'none' is implicitly allowed."
    },
    "delegation_policy": {
      "type": "object",
      "additionalProperties": false,
      "description": "Constraints on agent-to-agent delegation chains. Controls how deep delegation can go, how many total delegations are allowed, and how many siblings a single agent may delegate to.",
      "properties": {
        "max_depth": {
          "type": "integer",
          "minimum": 0,
          "description": "Maximum depth of nested delegation. 0 means no delegation is allowed. 1 means the agent may delegate but the delegate may not sub-delegate."
        },
        "max_total_delegations": {
          "type": "integer",
          "minimum": 0,
          "description": "Maximum number of total delegation events permitted across the entire session, regardless of depth."
        },
        "max_sibling_delegations": {
          "type": "integer",
          "minimum": 0,
          "description": "Maximum number of concurrent delegations from a single agent at any point in the delegation tree."
        }
      }
    },
    "metadata": {
      "type": "object",
      "additionalProperties": {
        "type": "string"
      },
      "description": "Arbitrary key-value metadata attached to the declaration. Useful for operator-defined labels, environment tags, or deployment context. All values must be strings."
    },
    "created_at": {
      "type": "string",
      "format": "date-time",
      "description": "ISO 8601 timestamp of when this declaration was created. Used for audit trails and temporal ordering."
    }
  }
}
