{
  "id": "decl-cr-20260310-a7f3",
  "session_id": "sess-cr-20260310-b2e1",
  "allowed_actions": [
    "read",
    "write",
    "search",
    "summarize"
  ],
  "allowed_tools": [
    "read_file",
    "list_files",
    "search_code",
    "post_comment",
    "request_changes",
    "approve_pr"
  ],
  "allowed_resources": [
    "github.com/acme/widget-api/pull/142",
    "github.com/acme/widget-api/tree/feat/auth-refactor"
  ],
  "allowed_resource_families": [
    "code",
    "documentation",
    "pull_request"
  ],
  "allowed_side_effects": [
    "none",
    "internal_write"
  ],
  "delegation_policy": {
    "max_depth": 1,
    "max_total_delegations": 2,
    "max_sibling_delegations": 1
  },
  "metadata": {
    "purpose": "Automated code review of authentication refactor PR",
    "owner": "platform-team@acme.com",
    "environment": "ci-review",
    "pr_number": "142",
    "repository": "acme/widget-api"
  },
  "created_at": "2026-03-10T09:00:00Z"
}
