{
  "id": "decl-da-20260310-c8d4",
  "session_id": "sess-da-20260310-e5f2",
  "allowed_actions": [
    "query",
    "read",
    "summarize",
    "send"
  ],
  "allowed_tools": [
    "run_sql_query",
    "read_table_schema",
    "generate_chart",
    "send_summary"
  ],
  "allowed_resources": [
    "warehouse.analytics.orders_2026q1",
    "warehouse.analytics.customers",
    "warehouse.analytics.products"
  ],
  "allowed_resource_families": [
    "database",
    "reporting"
  ],
  "allowed_side_effects": [
    "none",
    "external_send"
  ],
  "delegation_policy": {
    "max_depth": 0,
    "max_total_delegations": 0,
    "max_sibling_delegations": 0
  },
  "metadata": {
    "purpose": "Q1 2026 revenue analysis for executive summary",
    "owner": "data-eng@acme.com",
    "environment": "analytics-prod",
    "report_deadline": "2026-03-15",
    "sensitivity": "internal-confidential"
  },
  "created_at": "2026-03-10T14:30:00Z"
}
